{
  "$schema": "https://json-schema.org/draft/2020-12/schema", "format": "scoring-golden-scenario", "schemaVersion": "1.0.0", "scenarioId": "foil.same-side-and-lockout", "title": "Foil inhibits a second same-side hit and accepts an opposing hit before the provisional lockout", "weapon": "foil", "ruleRevision": "fie-2026-foil",
  "sources": [{ "authority": "fie", "id": "FOIL-05", "document": "fie-material-rules-2026-08-en.pdf", "page": 78, "locator": "Annex B, A.1(a).4-A.1(a).6" }, { "authority": "implementation", "id": "FOIL-TEST-LOCKOUT-WINDOW", "document": "src/foil.test.ts", "page": null, "locator": "inhibits a second same-side hit while permitting the opposing side before lockout" }],
  "lineModel": { "revision": "foil-logical-lines-1", "names": ["left.weapon-circuit", "left.target", "right.weapon-circuit", "right.target"] }, "determinism": { "seed": 0, "inputOrder": "listed", "resultOrder": "decision-atUs-then-id" }, "replay": { "clock": "virtual", "timeUnit": "us", "initialState": "fresh-bout", "hooks": { "firmwareIdentity": "golden-scenario-runner", "firmwareDigest": null, "scoringBootId": "golden-foil-same-side-lockout", "transportSequenceStart": 0, "captureId": null } },
  "inputs": [
    { "id": "left-start", "atUs": 0, "atUncertaintyUs": 0, "mode": "snapshot", "lines": [{ "line": "left.weapon-circuit", "state": "open", "resistanceMilliOhms": null, "resistanceUncertaintyMilliOhms": null }, { "line": "left.target", "state": "closed", "resistanceMilliOhms": null, "resistanceUncertaintyMilliOhms": null }, { "line": "right.weapon-circuit", "state": "closed", "resistanceMilliOhms": null, "resistanceUncertaintyMilliOhms": null }, { "line": "right.target", "state": "closed", "resistanceMilliOhms": null, "resistanceUncertaintyMilliOhms": null }] },
    { "id": "left-qualified", "atUs": 13000, "atUncertaintyUs": 0, "mode": "snapshot", "lines": [{ "line": "left.weapon-circuit", "state": "open", "resistanceMilliOhms": null, "resistanceUncertaintyMilliOhms": null }, { "line": "left.target", "state": "closed", "resistanceMilliOhms": null, "resistanceUncertaintyMilliOhms": null }, { "line": "right.weapon-circuit", "state": "closed", "resistanceMilliOhms": null, "resistanceUncertaintyMilliOhms": null }, { "line": "right.target", "state": "closed", "resistanceMilliOhms": null, "resistanceUncertaintyMilliOhms": null }] },
    { "id": "left-rearm-closed", "atUs": 14000, "atUncertaintyUs": 0, "mode": "snapshot", "lines": [{ "line": "left.weapon-circuit", "state": "closed", "resistanceMilliOhms": null, "resistanceUncertaintyMilliOhms": null }, { "line": "left.target", "state": "closed", "resistanceMilliOhms": null, "resistanceUncertaintyMilliOhms": null }, { "line": "right.weapon-circuit", "state": "closed", "resistanceMilliOhms": null, "resistanceUncertaintyMilliOhms": null }, { "line": "right.target", "state": "closed", "resistanceMilliOhms": null, "resistanceUncertaintyMilliOhms": null }] },
    { "id": "left-repeat-start", "atUs": 15000, "atUncertaintyUs": 0, "mode": "snapshot", "lines": [{ "line": "left.weapon-circuit", "state": "open", "resistanceMilliOhms": null, "resistanceUncertaintyMilliOhms": null }, { "line": "left.target", "state": "closed", "resistanceMilliOhms": null, "resistanceUncertaintyMilliOhms": null }, { "line": "right.weapon-circuit", "state": "closed", "resistanceMilliOhms": null, "resistanceUncertaintyMilliOhms": null }, { "line": "right.target", "state": "closed", "resistanceMilliOhms": null, "resistanceUncertaintyMilliOhms": null }] },
    { "id": "left-repeat-would-qualify", "atUs": 28000, "atUncertaintyUs": 0, "mode": "snapshot", "lines": [{ "line": "left.weapon-circuit", "state": "open", "resistanceMilliOhms": null, "resistanceUncertaintyMilliOhms": null }, { "line": "left.target", "state": "closed", "resistanceMilliOhms": null, "resistanceUncertaintyMilliOhms": null }, { "line": "right.weapon-circuit", "state": "closed", "resistanceMilliOhms": null, "resistanceUncertaintyMilliOhms": null }, { "line": "right.target", "state": "closed", "resistanceMilliOhms": null, "resistanceUncertaintyMilliOhms": null }] },
    { "id": "right-start-before-earliest-reference", "atUs": 275000, "atUncertaintyUs": 0, "mode": "snapshot", "lines": [{ "line": "left.weapon-circuit", "state": "open", "resistanceMilliOhms": null, "resistanceUncertaintyMilliOhms": null }, { "line": "left.target", "state": "closed", "resistanceMilliOhms": null, "resistanceUncertaintyMilliOhms": null }, { "line": "right.weapon-circuit", "state": "open", "resistanceMilliOhms": null, "resistanceUncertaintyMilliOhms": null }, { "line": "right.target", "state": "closed", "resistanceMilliOhms": null, "resistanceUncertaintyMilliOhms": null }] },
    { "id": "right-at-earliest-fie-reference", "atUs": 288000, "atUncertaintyUs": 0, "mode": "snapshot", "lines": [{ "line": "left.weapon-circuit", "state": "open", "resistanceMilliOhms": null, "resistanceUncertaintyMilliOhms": null }, { "line": "left.target", "state": "closed", "resistanceMilliOhms": null, "resistanceUncertaintyMilliOhms": null }, { "line": "right.weapon-circuit", "state": "open", "resistanceMilliOhms": null, "resistanceUncertaintyMilliOhms": null }, { "line": "right.target", "state": "closed", "resistanceMilliOhms": null, "resistanceUncertaintyMilliOhms": null }] }
  ],
  "expect": { "status": "accepted", "decisions": [{ "id": "left-first-hit", "decisionAtUs": 13000, "disposition": "qualified-hit", "side": "left", "weapon": "foil", "hitStartedAtUs": 0, "qualifiedAtUs": 13000, "signal": { "visual": "valid-hit", "audible": "requested", "latched": true }, "sourceInputIds": ["left-start", "left-qualified"] }, { "id": "right-hit-at-earliest-reference", "decisionAtUs": 288000, "disposition": "qualified-hit", "side": "right", "weapon": "foil", "hitStartedAtUs": 275000, "qualifiedAtUs": 288000, "signal": { "visual": "valid-hit", "audible": "requested", "latched": true }, "sourceInputIds": ["right-start-before-earliest-reference", "right-at-earliest-fie-reference"] }], "nonEvents": [{ "id": "left-repeat-is-inhibited", "window": { "fromUs": 15000, "throughUs": 288000 }, "assertion": "no-decision", "side": "left", "assertionReasonCode": "same-side-close-rearm-open-attempt-inhibited" }], "uncertainty": [], "finalState": { "hitCount": 2, "isLocked": false } }
}
