{
  "$schema": "https://json-schema.org/draft/2020-12/schema",
  "format": "scoring-golden-scenario",
  "schemaVersion": "1.0.0",
  "scenarioId": "sabre.own-equipment-hit-continuity",
  "title": "Sabre logical own-equipment fault input does not suppress simultaneous target hits",
  "weapon": "sabre",
  "ruleRevision": "fie-2026-sabre",
  "sources": [
    { "authority": "fie", "id": "SABRE-01", "document": "fie-material-rules-2026-08-en.pdf", "page": 81, "locator": "Annex B, C(a).1-C(a).4" },
    { "authority": "fie", "id": "SABRE-04", "document": "fie-material-rules-2026-08-en.pdf", "page": 82, "locator": "Annex B, C(b).3" },
    { "authority": "implementation", "id": "SABRE-TEST-OWN-EQUIPMENT-CONTINUITY", "document": "src/sabre.test.ts", "page": null, "locator": "does not let an own-equipment diagnostic suppress an independent opponent hit" }
  ],
  "lineModel": { "revision": "sabre-logical-lines-1", "names": ["left.target", "left.fault", "right.target", "right.fault"] },
  "determinism": { "seed": 0, "inputOrder": "listed", "resultOrder": "decision-atUs-then-id" },
  "replay": { "clock": "virtual", "timeUnit": "us", "initialState": "fresh-bout", "hooks": { "firmwareIdentity": "golden-scenario-runner", "firmwareDigest": null, "scoringBootId": "golden-sabre-own-equipment-continuity", "transportSequenceStart": 0, "captureId": null } },
  "inputs": [
    { "id": "both-start-left-fault", "atUs": 0, "atUncertaintyUs": 0, "mode": "snapshot", "lines": [
      { "line": "left.target", "state": "closed", "resistanceMilliOhms": null, "resistanceUncertaintyMilliOhms": null }, { "line": "left.fault", "state": "closed", "resistanceMilliOhms": null, "resistanceUncertaintyMilliOhms": null }, { "line": "right.target", "state": "closed", "resistanceMilliOhms": null, "resistanceUncertaintyMilliOhms": null }, { "line": "right.fault", "state": "open", "resistanceMilliOhms": null, "resistanceUncertaintyMilliOhms": null }
    ] },
    { "id": "both-qualified-left-fault", "atUs": 100, "atUncertaintyUs": 0, "mode": "snapshot", "lines": [
      { "line": "left.target", "state": "closed", "resistanceMilliOhms": null, "resistanceUncertaintyMilliOhms": null }, { "line": "left.fault", "state": "closed", "resistanceMilliOhms": null, "resistanceUncertaintyMilliOhms": null }, { "line": "right.target", "state": "closed", "resistanceMilliOhms": null, "resistanceUncertaintyMilliOhms": null }, { "line": "right.fault", "state": "open", "resistanceMilliOhms": null, "resistanceUncertaintyMilliOhms": null }
    ] }
  ],
  "expect": {
    "status": "accepted",
    "decisions": [
      { "id": "left-hit", "decisionAtUs": 100, "disposition": "qualified-hit", "weapon": "sabre", "side": "left", "hitStartedAtUs": 0, "qualifiedAtUs": 100, "signal": { "visual": "valid-hit", "audible": "requested", "latched": true }, "sourceInputIds": ["both-start-left-fault", "both-qualified-left-fault"] },
      { "id": "right-hit", "decisionAtUs": 100, "disposition": "qualified-hit", "weapon": "sabre", "side": "right", "hitStartedAtUs": 0, "qualifiedAtUs": 100, "signal": { "visual": "valid-hit", "audible": "requested", "latched": true }, "sourceInputIds": ["both-start-left-fault", "both-qualified-left-fault"] }
    ],
    "nonEvents": [],
    "uncertainty": [],
    "finalState": { "hitCount": 2, "isLocked": false }
  }
}
